{
  "uf": "MA",
  "uf_nome": "Maranhão",
  "vintage": {
    "censo_escolar": "2024",
    "rais": "2023",
    "caged": "2025-Q1",
    "pnad": "2025",
    "ideb": "2023"
  },
  "last_built": "2026-05-07T23:55:52.761312+00:00",
  "indicators": {
    "cob_distribuicao_dependencia": {
      "total_estado": {
        "federal": 22.88,
        "estadual": 72.17,
        "municipal": 0.26,
        "privada": 4.68,
        "total_matriculas": 53670,
        "vs_top_quartile": null,
        "vs_media_nacional": null,
        "vs_meta_pne_2034": null,
        "meta_pne_aplicavel": false,
        "posicao": null
      },
      "vintage": "2024",
      "caveat": "Sistema S agregado em 'privada'."
    },
    "cob_municipios_com_ept": {
      "total_estado": {
        "valor": 56.22,
        "valor_5y": [
          32.72,
          56.22
        ],
        "anos_5y": [
          2023,
          2024
        ],
        "vs_top_quartile": 0.24,
        "vs_media_nacional": 10.29,
        "vs_meta_pne_2034": null,
        "meta_pne_aplicavel": false,
        "posicao": 6
      },
      "rede_estadual": {
        "valor": 51.15,
        "valor_5y": [
          22.12,
          51.15
        ],
        "anos_5y": [
          2023,
          2024
        ],
        "vs_top_quartile": -2.77,
        "vs_media_nacional": 10.62,
        "vs_meta_pne_2034": null,
        "meta_pne_aplicavel": false,
        "posicao": 9
      },
      "total_municipios": 217,
      "vintage": "2024",
      "caveat": "Município conta igual independente do tamanho."
    },
    "cob_eixos_cobertos": {
      "total_estado": {
        "valor": null,
        "cursos_distintos": 87,
        "total_matriculas": 71075,
        "vs_top_quartile": null,
        "vs_media_nacional": null,
        "vs_meta_pne_2034": null,
        "meta_pne_aplicavel": false,
        "posicao": null
      },
      "vintage": "2024",
      "caveat": "Mapeamento curso→eixo (CNCT v4) pendente. Reportando contagem bruta de cursos distintos por enquanto."
    },
    "cob_distribuicao_modalidade": {
      "total_estado": {
        "total_matriculas_ept": 71075,
        "etapas_distintas": 9,
        "vs_top_quartile": null,
        "vs_media_nacional": null,
        "vs_meta_pne_2034": null,
        "meta_pne_aplicavel": false,
        "posicao": null
      },
      "vintage": "2024",
      "caveat": "Classificação etapa_ensino → modalidade (integrada/concomitante/subsequente) pendente."
    },
    "qua_taxas_rendimento_ept": {
      "total_estado": {
        "valor": 22.33,
        "aprovacao": 5.15,
        "reprovacao": 14.3,
        "abandono": 22.33,
        "vs_top_quartile": -6.46,
        "vs_media_nacional": 4.47,
        "vs_meta_pne_2034": null,
        "meta_pne_aplicavel": false,
        "posicao": 15
      },
      "rede_estadual": {
        "valor": 23.55,
        "aprovacao": 4.48,
        "reprovacao": 3.41,
        "abandono": 23.55,
        "vs_top_quartile": 0.86,
        "vs_media_nacional": 11.78,
        "vs_meta_pne_2034": null,
        "meta_pne_aplicavel": false,
        "posicao": 21
      },
      "polaridade_inversa": true,
      "vintage": "2024",
      "caveat": "Taxa de abandono EM ponderada por matrículas EPT (proxy). taxa_aprovacao_em do BD está em escala atípica (~0-20) e foi exibida no card mas não usada para ranking."
    },
    "qua_ideb_escolas_ept": {
      "total_estado": {
        "valor": 4.25,
        "valor_5y": [
          4.25
        ],
        "anos_5y": [
          2023
        ],
        "vs_top_quartile": -0.63,
        "vs_media_nacional": -0.35,
        "vs_meta_pne_2034": null,
        "meta_pne_aplicavel": false,
        "posicao": 17
      },
      "rede_estadual": {
        "valor": 4.18,
        "valor_5y": [
          4.18
        ],
        "anos_5y": [
          2023
        ],
        "vs_top_quartile": -0.54,
        "vs_media_nacional": -0.32,
        "vs_meta_pne_2034": null,
        "meta_pne_aplicavel": false,
        "posicao": 14
      },
      "vintage": "2023",
      "caveat": "IDEB-EM bianual. Mede ambiente pedagógico, não componente técnico."
    },
    "qua_razao_aluno_professor_ept": {
      "total_estado": {
        "valor": 10.63,
        "valor_5y": [
          10.63
        ],
        "anos_5y": [
          2024
        ],
        "vs_top_quartile": -5.5,
        "vs_media_nacional": -3.1,
        "vs_meta_pne_2034": null,
        "meta_pne_aplicavel": false,
        "posicao": 9
      },
      "rede_estadual": {
        "valor": 9.33,
        "valor_5y": [
          9.33
        ],
        "anos_5y": [
          2024
        ],
        "vs_top_quartile": -4.37,
        "vs_media_nacional": -1.8,
        "vs_meta_pne_2034": null,
        "meta_pne_aplicavel": false,
        "posicao": 16
      },
      "polaridade_inversa": true,
      "vintage": "2024",
      "caveat": "Razão menor é melhor. Agregação a nível escola (Censo Escolar via tabela escola). Docentes que atuam em múltiplas escolas são contados em cada uma."
    },
    "inf_conectividade_ept": {
      "total_estado": {
        "valor": 65.22,
        "tier_distribuicao": {
          "banda_larga_com_uso_aluno": 65.22,
          "banda_larga_sem_uso_aluno": 18.58,
          "internet_basica_sem_banda_larga": 9.09,
          "sem_internet": 7.11
        },
        "valor_5y": [
          70.41,
          65.22
        ],
        "anos_5y": [
          2023,
          2024
        ],
        "vs_top_quartile": -24.74,
        "vs_media_nacional": -15.49,
        "vs_meta_pne_2034": -34.78,
        "meta_pne_aplicavel": true,
        "posicao": 25
      },
      "rede_estadual": {
        "valor": 63.64,
        "tier_distribuicao": {
          "banda_larga_com_uso_aluno": 63.64,
          "banda_larga_sem_uso_aluno": 21.39,
          "internet_basica_sem_banda_larga": 9.63,
          "sem_internet": 5.35
        },
        "valor_5y": [
          71.43,
          63.64
        ],
        "anos_5y": [
          2023,
          2024
        ],
        "vs_top_quartile": -27.03,
        "vs_media_nacional": -12.59,
        "vs_meta_pne_2034": -36.36,
        "meta_pne_aplicavel": true,
        "posicao": 20
      },
      "vintage": "2024",
      "caveat": "Auto-declaratório. Velocidade real (Mbps) não coletada pelo Censo."
    },
    "mer_saldo_caged_tecnicos": {
      "total_estado": {
        "valor": 1891.0,
        "saldo_12m": 1891,
        "top_3_subfamilias_cbo": [
          {
            "cbo": "334110",
            "saldo": 230
          },
          {
            "cbo": "322205",
            "saldo": 219
          },
          {
            "cbo": "331110",
            "saldo": 191
          }
        ],
        "valor_5y": [
          5035.0,
          4173.0,
          1156.0,
          1384.0,
          1891.0
        ],
        "anos_5y": [
          2021,
          2022,
          2023,
          2024,
          2025
        ]
      },
      "vintage": "2025-Q1",
      "caveat": "Apenas vínculos formais. CBO 3xxxx exclui ocupações afins em 5xxxx/7xxxx."
    },
    "mer_premio_salarial_escolaridade": {
      "total_estado": {
        "valor": 130.6,
        "medianas_brl_real": {
          "sem_ensino_medio": 1668.52,
          "ensino_medio_completo": 1709.54,
          "superior_completo": 3942.0
        },
        "premios_pct": {
          "em_vs_sem_em": 2.5,
          "superior_vs_em": 130.6,
          "superior_vs_sem_em": 136.3
        },
        "premio_ept_especifico_publicamente_mensuravel": false,
        "vintage_rais": "2023",
        "vs_top_quartile": 0.0,
        "vs_media_nacional": 14.73,
        "vs_meta_pne_2034": null,
        "meta_pne_aplicavel": false,
        "posicao": 7
      },
      "vintage": "2023",
      "caveat": "RAIS não distingue EM regular de EM técnico em microdados públicos. Prêmio EPT específico exige cruzamento Censo×RAIS por CPF."
    },
    "mer_neet_rate": {
      "total_estado": {
        "valor": 30.1,
        "por_faixa_etaria": {
          "15_17": 6.5,
          "18_24": 38.14,
          "25_29": 33.91
        },
        "por_sexo": {
          "homens": 21.97,
          "mulheres": 37.98
        },
        "composicao_neet": {
          "desempregados_buscando_pct": 15.52,
          "inativos_nao_procurando_pct": 84.48
        },
        "valor_5y": [
          36.65,
          33.41,
          31.91,
          31.29,
          30.1
        ],
        "anos_5y": [
          2021,
          2022,
          2023,
          2024,
          2025
        ],
        "polaridade_inversa": true,
        "vs_top_quartile": 3.35,
        "vs_media_nacional": 10.24,
        "vs_meta_pne_2034": null,
        "meta_pne_aplicavel": false,
        "posicao": 26
      },
      "vintage": "2025",
      "caveat": "PNAD amostral. Estados de pop menor têm IC mais amplo."
    },
    "din_crescimento_matriculas_5y": {
      "total_estado": {
        "valor": 68.17,
        "crescimento_5y_pct": 68.17,
        "cagr_5y_pct": 10.96,
        "matriculas_base": 42264,
        "matriculas_atual": 71075,
        "base_insuficiente": false,
        "vs_top_quartile": 32.06,
        "vs_media_nacional": 34.05,
        "vs_meta_pne_2034": 8.170000000000002,
        "meta_pne_aplicavel": true,
        "posicao": 4
      },
      "rede_estadual": {
        "valor": null,
        "crescimento_5y_pct": null,
        "cagr_5y_pct": null,
        "matriculas_base": 0,
        "matriculas_atual": 0,
        "base_insuficiente": true,
        "vs_top_quartile": null,
        "vs_media_nacional": null,
        "vs_meta_pne_2034": null,
        "meta_pne_aplicavel": false,
        "posicao": null
      },
      "vintage": "2024",
      "caveat": "Janela 2019→2024 (Censo Escolar via tabela turma). Redes com base <1000 matrículas têm crescimento suprimido (alta variância). Decomposição por modalidade pendente."
    },
    "din_cursos_novos_ept": {
      "total_estado": {
        "valor": 395.0,
        "cursos_novos_2y": 496,